No.,Author,Comment
0,ds.hoanghungbg,"ự Mc thắng 2-1. Và thua trận lượt về 2-0, và bị loại."
1,Nguyen Vinh,"ẹn Pep ở C1 năm sau thôi, chứ Tuchel là khắc tinh của Pep rồi. Man xanh nên tự trách trò bốc thăm may rủi này.
Giờ gom được đội hình gồm M3P làm tiền đạo, KevinDB, Bruno, Kroos, Modric làmtiền vệ như năm xưa có M10, Xavi, Inies, Busq thì may ra Pep có C1.
Pep nên ước ao luôn đi là vừa."
2,Tinh,"ằng tất cả sự cảm tính, tôi đoán Bayern Munich sẽ vô địch Champions League 2023."
3,Hồng Sơn,ay mắn chỉ chiếm 5% thôi . 95% là nỗ lực bởi để đi đến trận chung kết họ phải trải qua một chặng đường dài và đầy khắc nghiệt . Để vận hành được một đội bóng thi đấu đỉnh cao như Chelsea đòi hỏi phải có sự cố gắng làm việc của một đội ngũ bao nhiêu ban ngành .
4,Hà Giang,"rời ơi, tui mới nhấn vào Bayern vô địch 7 lần huhu có lẽ nào. Mong ông trời đừng nghiệt ngã với Pep, chúc Pep và Mc chiến thắng!"
5,buituanhung2412,ự đoán BM thắng 2 lượt
6,Stefan Le,"ói thẳng là rùa là may là cơ duyên thôi chứ chelsea ko có cửa đâu , 1 đội cho dù đá hay cách mấy nhưng ko phải là chân mạng thiên tử thì cũng chả lấy dc cup , điển hình là dimateo lấy c1 bằng cái cách mà ko ai có thể nằm mơ thấy"
